{
  "name": "process-cleanup",
  "version": "6.1.0",
  "description": "Cleanup orphaned MCP server processes on session exit — workaround for upstream bug #1935",
  "author": {
    "name": "JacobPEvans"
  },
  "license": "Apache-2.0",
  "repository": "https://github.com/JacobPEvans/claude-code-plugins",
  "keywords": [
    "hooks",
    "cleanup",
    "mcp",
    "orphan",
    "process",
    "stop"
  ]
}
