{
  "name": "content-guards",
  "version": "6.1.1",
  "description": "Combined content validation and guard plugin: token-validator, markdown-validator, readme-validator, webfetch-guard, issue/PR backlog limiter, and a public-repo leakage guard",
  "author": {
    "name": "JacobPEvans"
  },
  "license": "Apache-2.0",
  "keywords": [
    "hooks",
    "validation",
    "content-guards",
    "token-limits",
    "markdown",
    "readme",
    "webfetch",
    "issue-management",
    "backlog-limits",
    "code-quality"
  ],
  "skills": [
    "./skills/validate-readme"
  ]
}
