{
  "name": "codeql-resolver",
  "version": "6.1.1",
  "description": "Systematic CodeQL alert analysis and resolution for GitHub Actions workflows",
  "author": {
    "name": "JacobPEvans"
  },
  "license": "Apache-2.0",
  "repository": "https://github.com/JacobPEvans/claude-code-plugins",
  "keywords": [
    "codeql",
    "security",
    "github-actions",
    "workflow",
    "permissions"
  ],
  "commands": [
    "./commands/resolve-codeql.md"
  ],
  "agents": [
    "./agents/codeql-permissions-auditor.md",
    "./agents/codeql-expression-injector.md",
    "./agents/codeql-generic-resolver.md"
  ],
  "skills": [
    "./skills/codeql-permission-classification",
    "./skills/github-workflow-security-patterns"
  ]
}
