{
  "name": "issue-limiter",
  "version": "1.0.0",
  "description": "PreToolUse hook that enforces GitHub issue creation limits to prevent backlog overflow",
  "author": {
    "name": "JacobPEvans",
    "email": "20714140+JacobPEvans@users.noreply.github.com"
  },
  "license": "Apache-2.0",
  "keywords": [
    "hooks",
    "pre-tool-use",
    "github",
    "issues",
    "limits",
    "backlog-management"
  ]
}
