{
  "name": "infra-standards",
  "version": "6.1.1",
  "description": "Infrastructure standards for Proxmox, Terraform, Ansible: VMID/IP assignment ranges and the Terraform-to-Ansible inventory contract",
  "author": {
    "name": "JacobPEvans"
  },
  "license": "MIT",
  "repository": "https://github.com/JacobPEvans/claude-code-plugins",
  "keywords": [
    "infrastructure",
    "terraform",
    "ansible",
    "proxmox"
  ],
  "skills": [
    "./skills/infrastructure-standards"
  ]
}
