{
  "name": "git-rebase-workflow",
  "version": "1.0.0",
  "description": "Local rebase-merge workflow for linear git history and signed commits",
  "author": {
    "name": "JacobPEvans",
    "email": "20714140+JacobPEvans@users.noreply.github.com"
  },
  "license": "MIT",
  "keywords": [
    "git",
    "rebase",
    "merge",
    "linear-history",
    "commands",
    "pr-workflow",
    "signed-commits"
  ]
}
