{
  "name": "session-analytics",
  "version": "6.1.1",
  "description": "Claude Code session token analytics via Splunk OTEL telemetry",
  "author": {
    "name": "JacobPEvans"
  },
  "license": "Apache-2.0",
  "repository": "https://github.com/JacobPEvans/claude-code-plugins",
  "keywords": [
    "analytics",
    "tokens",
    "splunk",
    "telemetry",
    "otel"
  ],
  "skills": [
    "./skills/token-breakdown"
  ]
}
