{
  "name": "code-standards",
  "version": "6.1.0",
  "description": "Code quality standards, documentation formatting, testing philosophy, and review guidelines",
  "author": {
    "name": "JacobPEvans"
  },
  "license": "MIT",
  "repository": "https://github.com/JacobPEvans/claude-code-plugins",
  "keywords": [
    "code",
    "quality",
    "review",
    "testing",
    "documentation",
    "standards"
  ],
  "skills": [
    "./skills/code-quality-standards",
    "./skills/review-standards"
  ]
}
