{
  "name": "token-validator",
  "version": "1.0.0",
  "description": "PreToolUse hook that validates file token limits on Write and Edit operations",
  "author": {
    "name": "JacobPEvans",
    "email": "20714140+JacobPEvans@users.noreply.github.com"
  },
  "license": "MIT",
  "keywords": [
    "hooks",
    "pre-tool-use",
    "token-limits",
    "file-size",
    "validation",
    "code-quality"
  ]
}
