{
  "name": "github-workflows",
  "version": "6.1.0",
  "description": "PR finalization (single, repo-wide, or org-wide including bots), repo refresh, rebase-merge, merge, review thread resolution, issue shaping, issue sweeping that reconciles open issues against reality, and diagnosing silent GitHub Actions failures",
  "author": {
    "name": "JacobPEvans"
  },
  "license": "Apache-2.0",
  "repository": "https://github.com/JacobPEvans/claude-code-plugins",
  "keywords": [
    "github",
    "pull-request",
    "issues",
    "pr-management",
    "rebase",
    "refresh",
    "shape-up",
    "workflow"
  ],
  "skills": [
    "./skills/finalize-pr",
    "./skills/ship",
    "./skills/merge-pr",
    "./skills/rebase-pr",
    "./skills/promote-release",
    "./skills/refresh-repo",
    "./skills/prune-branches",
    "./skills/gh-cli-patterns",
    "./skills/shape-issues",
    "./skills/issue-sweep",
    "./skills/resolve-pr-threads",
    "./skills/trigger-ai-reviews",
    "./skills/shared-workflow-org-refs",
    "./skills/pr-sweep",
    "./skills/github-code-search",
    "./skills/github-actions-silent-failures"
  ]
}
